<?xml version="1.0" encoding="UTF-8"?>
<xsd:schema xmlns:xsd="http://www.w3.org/2000/10/XMLSchema" xmlns:od="urn:schemas-microsoft-com:officedata">
<xsd:element name="dataroot">
<xsd:complexType>
<xsd:choice maxOccurs="unbounded">
<xsd:element ref="Requester"/>
</xsd:choice>
</xsd:complexType>
</xsd:element>
<xsd:element name="Requester">
<xsd:annotation>
<xsd:appinfo>
<od:index index-name="PrimaryKey" index-key="ID " primary="yes" unique="yes" clustered="no"/>
<od:index index-name="ID" index-key="ID " primary="no" unique="no" clustered="no"/>
<od:index index-name="ProductID" index-key="ProductID " primary="no" unique="no" clustered="no"/>
<od:index index-name="ProductRequester" index-key="ProductID " primary="no" unique="no" clustered="no"/>
<od:index index-name="SourceID" index-key="SourceID " primary="no" unique="no" clustered="no"/>
<od:index index-name="SourceRequester" index-key="SourceID " primary="no" unique="no" clustered="no"/>
</xsd:appinfo>
</xsd:annotation>
<xsd:complexType>
<xsd:sequence>
<xsd:element name="ID" od:jetType="autonumber" od:sqlSType="int" od:autoUnique="yes" od:nonNullable="yes">
<xsd:simpleType>
<xsd:restriction base="xsd:integer"/>
</xsd:simpleType>
</xsd:element>
<xsd:element name="Salutation" minOccurs="0" od:jetType="text" od:sqlSType="nvarchar">
<xsd:simpleType>
<xsd:restriction base="xsd:string">
<xsd:maxLength value="6"/>
</xsd:restriction>
</xsd:simpleType>
</xsd:element>
<xsd:element name="LastName" minOccurs="0" od:jetType="text" od:sqlSType="nvarchar">
<xsd:simpleType>
<xsd:restriction base="xsd:string">
<xsd:maxLength value="30"/>
</xsd:restriction>
</xsd:simpleType>
</xsd:element>
<xsd:element name="FirstName" minOccurs="0" od:jetType="text" od:sqlSType="nvarchar">
<xsd:simpleType>
<xsd:restriction base="xsd:string">
<xsd:maxLength value="20"/>
</xsd:restriction>
</xsd:simpleType>
</xsd:element>
<xsd:element name="Address1" minOccurs="0" od:jetType="text" od:sqlSType="nvarchar">
<xsd:simpleType>
<xsd:restriction base="xsd:string">
<xsd:maxLength value="50"/>
</xsd:restriction>
</xsd:simpleType>
</xsd:element>
<xsd:element name="Address2" minOccurs="0" od:jetType="text" od:sqlSType="nvarchar">
<xsd:simpleType>
<xsd:restriction base="xsd:string">
<xsd:maxLength value="50"/>
</xsd:restriction>
</xsd:simpleType>
</xsd:element>
<xsd:element name="City" minOccurs="0" od:jetType="text" od:sqlSType="nvarchar">
<xsd:simpleType>
<xsd:restriction base="xsd:string">
<xsd:maxLength value="25"/>
</xsd:restriction>
</xsd:simpleType>
</xsd:element>
<xsd:element name="State" minOccurs="0" od:jetType="text" od:sqlSType="nvarchar">
<xsd:simpleType>
<xsd:restriction base="xsd:string">
<xsd:maxLength value="2"/>
</xsd:restriction>
</xsd:simpleType>
</xsd:element>
<xsd:element name="Zip" minOccurs="0" od:jetType="text" od:sqlSType="nvarchar">
<xsd:simpleType>
<xsd:restriction base="xsd:string">
<xsd:maxLength value="5"/>
</xsd:restriction>
</xsd:simpleType>
</xsd:element>
<xsd:element name="ProductID" minOccurs="0" od:jetType="longinteger" od:sqlSType="int">
<xsd:simpleType>
<xsd:restriction base="xsd:integer"/>
</xsd:simpleType>
</xsd:element>
<xsd:element name="SourceID" minOccurs="0" od:jetType="longinteger" od:sqlSType="int">
<xsd:simpleType>
<xsd:restriction base="xsd:integer"/>
</xsd:simpleType>
</xsd:element>
<xsd:element name="Amount" minOccurs="0" od:jetType="double" od:sqlSType="float" type="xsd:double"/>
</xsd:sequence>
</xsd:complexType>
</xsd:element>
</xsd:schema>
